record_id,report_type,item_name,category,location,date_reported,description,status,contact
LF-001,Lost,Laptop Charger,Electronics,"Building 6, Room 204",2026-02-02,Black Lenovo charger left after class,Open,student01@example.com
LF-002,Found,Water Bottle,Personal,Library 2nd Floor,2026-02-03,Blue bottle found near study table,Pending Verification,security@example.com
LF-003,Lost,Student ID Card,Personal,Canteen Area,2026-02-04,Student ID card lost during lunch,Open,student02@example.com
LF-004,Found,Umbrella,Personal,Main Entrance,2026-02-04,Small black umbrella found near door,Claimed,security@example.com
LF-005,Lost,Earbuds Case,Electronics,Computer Lab,2026-02-05,White earbuds case missing after lab,Open,student03@example.com
LF-006,Found,Notebook,Stationery,Building 5 Hallway,2026-02-05,Green notebook with course notes,Closed,staff01@example.com
LF-007,Lost,Denim Jacket,Clothing,Building 3 Cafeteria,2026-02-06,Blue denim jacket left on chair,Open,student04@example.com
LF-008,Found,Basketball,Other,Sports Complex,2026-02-06,Orange Spalding basketball found on court,Open,security@example.com
